{
  "$schema": "http://json-schema.org/draft-07/schema#",
  "$id": "https://databricks-solutions.github.io/lakebase-app-dev-kit/schemas/story.schema.json",
  "title": "Story",
  "description": "A user story within a feature. Connects user motivation to acceptance criteria.",
  "type": "object",
  "required": ["id", "asA", "iWantTo", "soThat"],
  "properties": {
    "id": {
      "type": "string",
      "pattern": "^S[0-9]+(-[a-z0-9-]+)?$",
      "description": "Story identifier, e.g. S1 or S1-submit-form."
    },
    "asA": {
      "type": "string",
      "description": "User role or persona."
    },
    "iWantTo": {
      "type": "string",
      "description": "Capability the user wants."
    },
    "soThat": {
      "type": "string",
      "description": "Outcome or motivation."
    },
    "acs": {
      "type": "array",
      "items": { "type": "string", "pattern": "^AC[0-9]+(-[a-z0-9-]+)?$" },
      "description": "Acceptance criterion IDs belonging to this story."
    },
    "feature_id": {
      "type": "string",
      "pattern": "^F[0-9]+(-[a-z0-9-]+)?$",
      "description": "Parent feature ID."
    },
    "independence": {
      "type": "object",
      "description": "Breakdown-time determination that this story delivers behavior NOT already delivered by an earlier story in the feature (the story-independence test). Required for every story after the first (the spec gate hard-blocks a later story that omits it or sets distinct_from_prior:false); the first story has no prior and may omit it.",
      "required": ["distinct_from_prior", "rationale"],
      "additionalProperties": false,
      "properties": {
        "distinct_from_prior": {
          "type": "boolean",
          "description": "True iff building all earlier stories would leave this story's behavior genuinely unbuilt (independently RED-able). False means this story is a subset of an earlier one and must be folded or re-scoped."
        },
        "rationale": {
          "type": "string",
          "minLength": 1,
          "description": "One line: the distinct, independently-RED-able behavior this story adds beyond the prior stories."
        }
      }
    },
    "external_ref": {
      "type": "object",
      "properties": {
        "adapter": { "type": "string" },
        "external_id": { "type": "string" }
      }
    }
  },
  "additionalProperties": false
}
